iteration	score	status	candidate	operation	section_changes	description
0	0.6000	baseline	baseline	baseline	-	initial prompt (+/-0.0000)
1	0.7429	keep	simplify	ADD	tasks:+0.36	+1/-0 lines
2	0.7465	keep	coverage	ADD	tasks:+0.01	+1/-0 lines
3	0.8714	keep	balanced	REWORD	decisions:+0.50 tasks:+0.06	+1/-1 lines
4	0.7929	discard	simplify	REWORD	projects:+0.50 decisions:-0.50 tasks:-0.13	+1/-1 lines
5	0.8054	discard	coverage	REWORD	people:-0.25 tasks:-0.01	+1/-1 lines
6	0.9429	keep	coverage	REWORD	projects:+0.50 tasks:-0.01	+1/-1 lines
7	0.8929	discard	coverage	REWORD	tasks:-0.13	+1/-1 lines
8	0.8846	discard	simplify	ADD	decisions:-0.17 tasks:-0.06	+1/-0 lines
9	0.8215	discard	simplify	MERGE	decisions:-0.50 tasks:-0.05	+1/-2 lines
10	0.8465	discard	balanced	REORDER	decisions:-0.50 tasks:+0.01	+0/-0 lines
