iteration	score	status	candidate	operation	section_changes	description
0	0.7143	baseline	baseline	baseline	-	initial prompt (+/-0.0000)
1	0.7179	keep	simplify	ADD	tasks:+0.01	+1/-0 lines
2	0.7845	keep	simplify	ADD	decisions:+0.33	+1/-0 lines
3	0.7678	discard	coverage	REWORD	decisions:-0.33 tasks:+0.13	+1/-1 lines
4	0.8339	keep	balanced	ADD	people:-0.25 tasks:+0.20 decisions:+0.17	+1/-0 lines
5	0.9179	keep	balanced	REWORD	projects:+0.50 people:+0.25 decisions:-0.13 tasks:-0.07	+1/-1 lines
6	0.9131	discard	balanced	REWORD	decisions:-0.04 tasks:+0.01	+1/-1 lines
7	0.8345	discard	simplify	ADD	projects:-0.50 decisions:-0.04	+1/-0 lines
8	0.7678	discard	coverage	ADD	projects:-0.50 decisions:-0.38	+1/-0 lines
9	0.9429	keep	balanced	REWORD	decisions:+0.13	+1/-1 lines
10	0.9465	keep	coverage	REWORD	tasks:+0.01	+1/-1 lines
